{
  "$schema": "https://json-schema.org/draft/2020-12/schema",
  "$id": "https://f150-garage-assistant.local/schema/tool.schema.json",
  "title": "Tool",
  "type": "object",
  "required": [
    "id",
    "schemaVersion",
    "entityType",
    "knowledgeScope",
    "name",
    "description"
  ],
  "properties": {
    "id": {
      "type": "string",
      "pattern": "^[a-z0-9][a-z0-9._-]*$"
    },
    "schemaVersion": {
      "type": "integer",
      "minimum": 1
    },
    "entityType": {
      "const": "tool"
    },
    "knowledgeScope": {
      "enum": [
        "generic",
        "vehicle_specific",
        "configuration_specific"
      ]
    },
    "status": {
      "enum": [
        "draft",
        "verified",
        "deprecated"
      ]
    },
    "createdAt": {
      "type": [
        "string",
        "null"
      ],
      "format": "date-time"
    },
    "updatedAt": {
      "type": [
        "string",
        "null"
      ],
      "format": "date-time"
    },
    "name": {
      "type": "string"
    },
    "description": {
      "type": "string"
    },
    "category": {
      "type": "string"
    },
    "requiredByProcedureIds": {
      "type": "array",
      "items": {
        "type": "string"
      },
      "uniqueItems": true
    },
    "safetyNotes": {
      "type": "array",
      "items": {
        "type": "string"
      }
    },
    "referenceIds": {
      "type": "array",
      "items": {
        "type": "string"
      },
      "uniqueItems": true
    }
  },
  "additionalProperties": false
}
